{
  "version": "1.0.0",
  "id": "campus_gundam",
  "title": "校园高达",
  "theme": "school_campus",
  "art_tile_size": 64,
  "map": {
    "width": 64,
    "height": 64,
    "tile_width": 64,
    "tile_height": 64,
    "orientation": "orthogonal"
  },
  "regions": [
    {
      "id": "campus_plaza_01",
      "type": "campus_plaza",
      "position": "center",
      "size": "large",
      "priority": 95
    },
    {
      "id": "sculpture_corner_01",
      "type": "sculpture_corner",
      "position": "right",
      "size": "medium",
      "priority": 85
    },
    {
      "id": "mecha_airspace_01",
      "type": "airspace",
      "position": "top",
      "size": "large",
      "priority": 80
    }
  ],
  "paths": [],
  "objects": [
    {
      "type": "large_prop",
      "count": 1,
      "placement": "campus_plaza_01",
      "label": "校园喷泉",
      "properties": {
        "object_key": "campus_fountain",
        "display_name": "校园喷泉",
        "source_clause": "温馨校园中心有一座圆形石质喷泉，清澈水面和柔和水花，适合作为校园广场核心物件",
        "facing": "east_west",
        "footprint": "4x4",
        "source_canvas": [
          256,
          256
        ],
        "blocking": true,
        "material": "pale stone and clear water",
        "appearance": "round stone fountain, gentle water spray, warm campus atmosphere, readable from top-down RPG view"
      }
    },
    {
      "type": "large_prop",
      "count": 1,
      "placement": "sculpture_corner_01",
      "label": "阿狸雕塑",
      "properties": {
        "object_key": "ali_fox_statue",
        "display_name": "阿狸雕塑",
        "source_clause": "喷泉旁有一座温暖可爱的阿狸风格红色狐狸雕塑，像校园吉祥物一样摆放在小景观区",
        "facing": "faces_south",
        "footprint": "2x2",
        "source_canvas": [
          128,
          160
        ],
        "blocking": true,
        "material": "painted resin statue",
        "appearance": "friendly red fox mascot statue, rounded warm silhouette, small stone base, original campus sculpture interpretation"
      }
    },
    {
      "type": "npc",
      "count": 2,
      "placement": "mecha_airspace_01",
      "label": "悬浮机甲",
      "properties": {
        "object_key": "floating_mecha",
        "display_name": "悬浮机甲",
        "source_clause": "两台机甲悬浮在校园上空，带有轻微蓝色推进光，但不破坏温馨校园氛围",
        "facing": "faces_south",
        "footprint": "2x3",
        "source_canvas": [
          192,
          256
        ],
        "blocking": false,
        "activity": "hovering_above_ground",
        "appearance": "two friendly hovering sci-fi mecha, soft school-safe design, blue thruster glow, no combat pose"
      }
    }
  ],
  "base_terrain": {
    "object_key": "campus_ground",
    "display_name": "温馨校园地面",
    "tile": "grass",
    "source_clause": "温馨校园内的柔和草地与浅色铺装气氛，作为整张地图的基础地面",
    "source_canvas": [
      64,
      64
    ],
    "properties": {
      "appearance": "warm campus lawn ground tile with subtle paving flecks, clean and cozy, seamless tileable background"
    }
  },
  "composites": [],
  "entities": [],
  "constraints": {
    "walkable_spawn": true,
    "connect_key_regions": true,
    "no_blocked_doors": true,
    "objects_require_walkable_neighbor": true
  },
  "seed": 2026061001,
  "tileset_id": "default_rpg_32"
}
